<clientes xmlns:xsi="http://www.w3.org/2001/XMLSchema-instance"
 xsi:noNamespaceSchemaLocation="../xsd/input2.xsd">
<cliente>
	<id>2</id>
	<codigo>2</codigo>
	<pedido>
		<fecha>2024-12-12</fecha>
		<estado>confirmado</estado>
		<total>1.00</total>
		<detalle_pedido>
			<producto>
				<id_producto>6</id_producto>
			</producto>
			<cantidad>1</cantidad>
			<precio_unitario>1.00</precio_unitario>
		</detalle_pedido>
	</pedido>
</cliente>
<cliente>
	<id>3</id>
	<codigo>3</codigo>
	<pedido>
		<fecha>2024-12-12</fecha>
		<estado>confirmado</estado>
		<total>1.00</total>
		<detalle_pedido>
			<producto>
				<id_producto>7</id_producto>
			</producto>
			<cantidad>1</cantidad>
			<precio_unitario>1.00</precio_unitario>
		</detalle_pedido>
	</pedido>
</cliente>
</clientes>